{
  "app_concept": "Mermaido is a MermaidJS diagram visualizer.",
  "primary_metaphor": "An asymmetric seafoam mermaid tail curling up from teal waves",
  "supporting_motifs": [
    "A broad split fluke",
    "One foreground wave hiding the tail base"
  ],
  "composition_family": "fused-with-base",
  "tone": [
    "clear",
    "playful",
    "native macOS"
  ],
  "palette_hints": [
    "deep teal base",
    "aquamarine waves",
    "seafoam tail highlights"
  ],
  "include_symbols": [
    "wide split mermaid tail",
    "edge-fused wave bands",
    "tail emerging from the front wave"
  ],
  "avoid_symbols": [
    "text",
    "literal code",
    "Mermaid logo imitation",
    "tiny flowchart labels",
    "diagram nodes",
    "literal Mermaid logo",
    "full character illustration"
  ],
  "small_size_risk": "low"
}
